<?xml version="1.0" encoding="UTF-8"?>
<ns2:textureLibrary 
	xmlns:ns2="http://www.kendzi3d.org"
	xmlns:xsi="http://www.w3.org/2001/XMLSchema-instance"
	xsi:schemaLocation="http://www.kendzi3d.org xsd/TextureLibrary.xsd"
	
	author="Tomasz KÄ™dziora (Kendzi)"
	>
<!-- 	xmlns="http://www.kendzi3d.org"  -->
<!-- 	<ns2:textureLibrary xmlns:ns2="http://www.kendzi3d.org"> -->
	
	
	<!-- Buildings -->
	<textureSet key="buildings.facade_unknown">
		<textureData fileKey="#c=0xffe68c" height="1.0" width="1.0"/>
	</textureSet>
	<textureSet key="buildings.facade_plaster">
		<textureData fileKey="#c=0xffe68c" height="1.0" width="1.0"/>
	</textureSet>
	<textureSet key="buildings.facade_brick">
		<textureData fileKey="#c=0xffe68c" height="1.0" width="1.0"/>
	</textureSet>
	<textureSet key="buildings.facade_stone">
		<textureData fileKey="#c=0xffe68c" height="1.0" width="1.0"/>
	</textureSet>
	 
	<!-- Roof -->
	<textureSet key="buildings.roof_unknown">
		<textureData fileKey="#c=0xcd0000" height="1.0" width="1.0"/>
	</textureSet>
	<textureSet key="buildings.roof_roofTiles">
		<textureData fileKey="#c=0xcd0000" height="1.0" width="1.0"/>
	</textureSet>
	<textureSet key="buildings.roof_roofingFelt">
		<textureData fileKey="#c=0xcd0000" height="1.0" width="1.0"/>
	</textureSet>
	
	<textureSet key="buildings.window">	
		<textureData fileKey="#c=0xcf0f0f0" height="1" width="1"/>
	</textureSet>
	
	<!-- Barrier -->
	<textureSet key="barrier.fence_unknown">
		<textureData fileKey="#c=0xcf0f0f0" height="1" width="1"/>
	</textureSet>
	<textureSet key="barrier.fence_balustrade">
		<textureData fileKey="#c=0xcf0f0f0" height="1" width="1"/>
	</textureSet>


</ns2:textureLibrary>